<?xml version="1.0" encoding="UTF-8"?>
<!DOCTYPE scommesseTennis SYSTEM "scommesseTennis.dtd">
<!-- Esempi di 3 scommesse di tennis -->
<scommesseTennis>
    <scommessa eliminato="0">
        <id>1</id>
        <scommettitore>mario</scommettitore>
        <risultato>1</risultato>
        <puntata>30</puntata>
    </scommessa>
    
    <scommessa eliminato="0">
        <id>1</id>
        <scommettitore>mario</scommettitore>
        <risultato>2</risultato>
        <puntata>18</puntata>
    </scommessa>
   
    <scommessa eliminato="0">
        <id>2</id>
        <scommettitore>ciruzzo</scommettitore>
        <risultato>1</risultato>
        <puntata>10</puntata>
    </scommessa>
</scommesseTennis>
